{
  "items": [
    
    {
      "text": "Python",
      "keyword": "",
      "icon": "",
      "value_color": "",
      "text_color": "",
      "icon_color": "",
      "value": "62081 bytes (2.17%)"
    },
    
    {
      "text": "Go",
      "keyword": "",
      "icon": "",
      "value_color": "",
      "text_color": "",
      "icon_color": "",
      "value": "9139 bytes (0.32%)"
    },
    
    {
      "text": "Rust",
      "keyword": "",
      "icon": "",
      "value_color": "",
      "text_color": "",
      "icon_color": "",
      "value": "5433 bytes (0.19%)"
    },
    
    {
      "text": "Nix",
      "keyword": "",
      "icon": "",
      "value_color": "",
      "text_color": "",
      "icon_color": "",
      "value": "2303621 bytes (80.58%)"
    },
    
    {
      "text": "JavaScript",
      "keyword": "",
      "icon": "",
      "value_color": "",
      "text_color": "",
      "icon_color": "",
      "value": "4762 bytes (0.17%)"
    },
    
    {
      "text": "Shell",
      "keyword": "",
      "icon": "",
      "value_color": "",
      "text_color": "",
      "icon_color": "",
      "value": "92723 bytes (3.24%)"
    },
    
    {
      "text": "Ruby",
      "keyword": "",
      "icon": "",
      "value_color": "",
      "text_color": "",
      "icon_color": "",
      "value": "6782 bytes (0.24%)"
    },
    
    {
      "text": "HTML",
      "keyword": "",
      "icon": "",
      "value_color": "",
      "text_color": "",
      "icon_color": "",
      "value": "1238 bytes (0.04%)"
    },
    
    {
      "text": "Perl",
      "keyword": "",
      "icon": "",
      "value_color": "",
      "text_color": "",
      "icon_color": "",
      "value": "1236 bytes (0.04%)"
    },
    
    {
      "text": "CSS",
      "keyword": "",
      "icon": "",
      "value_color": "",
      "text_color": "",
      "icon_color": "",
      "value": "11263 bytes (0.39%)"
    },
    
    {
      "text": "Makefile",
      "keyword": "",
      "icon": "",
      "value_color": "",
      "text_color": "",
      "icon_color": "",
      "value": "471 bytes (0.02%)"
    },
    
    {
      "text": "Lua",
      "keyword": "",
      "icon": "",
      "value_color": "",
      "text_color": "",
      "icon_color": "",
      "value": "305293 bytes (10.68%)"
    },
    
    {
      "text": "Nu",
      "keyword": "",
      "icon": "",
      "value_color": "",
      "text_color": "",
      "icon_color": "",
      "value": "141 bytes (0.00%)"
    },
    
    {
      "text": "Nushell",
      "keyword": "",
      "icon": "",
      "value_color": "",
      "text_color": "",
      "icon_color": "",
      "value": "136 bytes (0.00%)"
    },
    
    {
      "text": "Sage",
      "keyword": "",
      "icon": "",
      "value_color": "",
      "text_color": "",
      "icon_color": "",
      "value": "14 bytes (0.00%)"
    },
    
    {
      "text": "Vim Script",
      "keyword": "",
      "icon": "",
      "value_color": "",
      "text_color": "",
      "icon_color": "",
      "value": "51161 bytes (1.79%)"
    },
    
    {
      "text": "C",
      "keyword": "",
      "icon": "",
      "value_color": "",
      "text_color": "",
      "icon_color": "",
      "value": "3288 bytes (0.12%)"
    }
    
  ],
  "ascii": {
    "path": "ascii/github",
    "colors": "",
    "enabled": true,
    "horizontal_padding": 0,
    "vertical_padding": 10,
    "position": "left"
  },
  "header": {
    "enabled": false,
    "text": "",
    "text_color": "",
    "line": true,
    "line_color": ""
  },
  "footer": {
    "enabled": false,
    "text": "",
    "text_color": "",
    "line": true,
    "line_color": ""
  },
  "general": {
    "menu_type": "list",
    "columns": true
  }
}