{
  "items": [
    {
      "text": "user",
      "keyword": "user",
      "icon": "",
      "value_color": "red",
      "text_color": "",
      "icon_color": "red",
      "value": "My user"
    },
    {
      "text": "cpu",
      "keyword": "cpu",
      "icon": "",
      "value_color": "yellow",
      "text_color": "",
      "icon_color": "yellow"
    },
    {
      "text": "cpu",
      "keyword": "cpu %",
      "icon": "",
      "value_color": "yellow",
      "text_color": "",
      "icon_color": "yellow"
    }
  ],
  "ascii": {
    "path": "ascii/gysmo",
    "colors": "",
    "enabled": true,
    "horizontal_padding": 0,
    "vertical_padding": 0,
    "position": "left"
  },
  "header": {
    "enabled": true,
    "text": "NixOS",
    "text_color": "purple",
    "line": true,
    "line_color": ""
  },
  "footer": {
    "enabled": true,
    "text": "gysmo",
    "text_color": "blue",
    "line": true,
    "line_color": ""
  },
  "general": {
    "menu_type": "box",
    "columns": false
  }
}
