{
    "items": [
        {
            "text": "Time",
            "icon": "\udb85\udc46",
            "value_color": "",
            "text_color": "",
            "icon_color": "",
            "value": "2025-03-05T19:30"
        },
        {
            "text": "Temperature",
            "icon": "\udb81\udd04",
            "value_color": "",
            "text_color": "",
            "icon_color": "cyan",
            "value": "4.9"
        },
        {
            "text": "Wind Speed",
            "icon": "\ue27e",
            "value_color": "",
            "text_color": "",
            "icon_color": "",
            "value": "30.2"
        },
        {
            "text": "Outside it is:",
            "icon": "\udb83\udf30",
            "value_color": "",
            "text_color": "",
            "icon_color": "blue",
            "value": "drizzle"
        }
    ],
    "ascii": {
        "path": "ascii/drizzle",
        "colors": "",
        "enabled": true,
        "horizontal_padding": 0,
        "vertical_padding": 0,
        "position": "left"
    },
    "header": {
        "enabled": true,
        "text": "Today's Weather",
        "text_color": "green",
        "line": true,
        "line_color": ""
    },
    "footer": {
        "enabled": false,
        "text": "",
        "text_color": "",
        "line": true,
        "line_color": ""
    },
    "general": {
        "menu_type": "box",
        "columns": false
    }
}