{
  "items": [
    {
      "text": "Time",
      "keyword": "",
      "icon": "\udb85\udc46",
      "value_color": "",
      "text_color": "",
      "icon_color": "",
      "value": "2025-02-10T14:30"
    },
    {
      "text": "Temperature",
      "keyword": "",
      "icon": "\udb81\udd04",
      "value_color": "",
      "text_color": "",
      "icon_color": "",
      "value": "-8.6"
    },
    {
      "text": "Wind Speed",
      "keyword": "",
      "icon": "\ue27e",
      "value_color": "",
      "text_color": "",
      "icon_color": "",
      "value": "18.2"
    },
    {
      "text": "Outside it is:",
      "keyword": "",
      "icon": "\udb83\udf30",
      "value_color": "yellow",
      "text_color": "",
      "icon_color": "",
      "value": "mainly clear"
    }
  ],
  "ascii": {
    "path": "ascii/mainly clear",
    "colors": "yellow",
    "enabled": true,
    "horizontal_padding": 0,
    "vertical_padding": 0,
    "position": "top"
  },
  "header": {
    "enabled": true,
    "text": "Today's Weather",
    "text_color": "white",
    "line": true,
    "line_color": ""
  },
  "footer": {
    "enabled": false,
    "text": "",
    "text_color": "",
    "line": true,
    "line_color": ""
  },
  "general": {
    "menu_type": "box",
    "columns": false
  }
}
