{
  "items": [
    {
      "text": "OS ANSI Color",
      "keyword": "os_ansi_color",
      "icon": "",
      "text_color": "",
      "value_color": "green",
      "icon_color": "blue"
    },
    {
      "text": "OS Pretty Name",
      "keyword": "os_pretty_name",
      "icon": "",
      "text_color": "",
      "value_color": "blue",
      "icon_color": "cyan"
    },
    {
      "text": "OS Bug Report URL",
      "keyword": "os_bug_report_url",
      "icon": "",
      "text_color": "",
      "value_color": "white",
      "icon_color": "red"
    },
    {
      "text": "OS Build ID",
      "keyword": "os_build_id",
      "icon": "",
      "text_color": "",
      "value_color": "yellow",
      "icon_color": "blue"
    },
    {
      "text": "OS CPE Name",
      "keyword": "os_cpe_name",
      "icon": "",
      "text_color": "",
      "value_color": "purple",
      "icon_color": "green"
    },
    {
      "text": "OS Default Hostname",
      "keyword": "os_default_hostname",
      "icon": "",
      "text_color": "",
      "value_color": "red",
      "icon_color": "yellow"
    },
    {
      "text": "OS Documentation URL",
      "keyword": "os_documentation_url",
      "icon": "",
      "text_color": "",
      "value_color": "cyan",
      "icon_color": "purple"
    },
    {
      "text": "OS Home URL",
      "keyword": "os_home_url",
      "icon": "",
      "text_color": "",
      "value_color": "green",
      "icon_color": "blue"
    },
    {
      "text": "OS ID",
      "keyword": "os_id",
      "icon": "",
      "text_color": "",
      "value_color": "blue",
      "icon_color": "cyan"
    },
    {
      "text": "OS ID Like",
      "keyword": "os_id_like",
      "icon": "",
      "text_color": "",
      "value_color": "white",
      "icon_color": "red"
    },
    {
      "text": "OS Image ID",
      "keyword": "os_image_id",
      "icon": "",
      "text_color": "",
      "value_color": "yellow",
      "icon_color": "blue"
    },
    {
      "text": "OS Image Version",
      "keyword": "os_image_version",
      "icon": "",
      "text_color": "",
      "value_color": "purple",
      "icon_color": "green"
    },
    {
      "text": "OS Version",
      "keyword": "os_version",
      "icon": "",
      "text_color": "",
      "value_color": "red",
      "icon_color": "yellow"
    },
    {
      "text": "OS Logo",
      "keyword": "os_logo",
      "icon": "",
      "text_color": "",
      "value_color": "cyan",
      "icon_color": "purple"
    },
    {
      "text": "OS Name",
      "keyword": "os_name",
      "icon": "",
      "text_color": "",
      "value_color": "green",
      "icon_color": "blue"
    },
    {
      "text": "OS Support URL",
      "keyword": "os_support_url",
      "icon": "",
      "text_color": "",
      "value_color": "blue",
      "icon_color": "cyan"
    },
    {
      "text": "OS Variant",
      "keyword": "os_variant",
      "icon": "",
      "text_color": "",
      "value_color": "white",
      "icon_color": "red"
    },
    {
      "text": "OS Variant ID",
      "keyword": "os_variant_id",
      "icon": "",
      "text_color": "",
      "value_color": "yellow",
      "icon_color": "blue"
    },
    {
      "text": "OS Vendor Name",
      "keyword": "os_vendor_name",
      "icon": "",
      "text_color": "",
      "value_color": "purple",
      "icon_color": "green"
    },
    {
      "text": "OS Vendor URL",
      "keyword": "os_vendor_url",
      "icon": "",
      "text_color": "",
      "value_color": "red",
      "icon_color": "yellow"
    },
    {
      "text": "OS Version Codename",
      "keyword": "os_version_codename",
      "icon": "",
      "text_color": "",
      "value_color": "cyan",
      "icon_color": "purple"
    },
    {
      "text": "OS Version ID",
      "keyword": "os_version_id",
      "icon": "",
      "text_color": "",
      "value_color": "green",
      "icon_color": "blue"
    },
    {
      "text": "User",
      "keyword": "user",
      "icon": "",
      "text_color": "",
      "value_color": "blue",
      "icon_color": "cyan"
    },
    {
      "text": "Hostname",
      "keyword": "hostname",
      "icon": "",
      "text_color": "",
      "value_color": "white",
      "icon_color": "red"
    },
    {
      "text": "Kernel",
      "keyword": "kernel",
      "icon": "",
      "text_color": "",
      "value_color": "yellow",
      "icon_color": "blue"
    },
    {
      "text": "Shell",
      "keyword": "shell",
      "icon": "",
      "text_color": "",
      "value_color": "purple",
      "icon_color": "green"
    },
    {
      "text": "Uptime",
      "keyword": "uptime",
      "icon": "",
      "text_color": "",
      "value_color": "red",
      "icon_color": "yellow"
    },
    {
      "text": "Desktop Manager",
      "keyword": "dm",
      "icon": "",
      "text_color": "",
      "value_color": "cyan",
      "icon_color": "purple"
    },
    {
      "text": "GPU",
      "keyword": "gpu",
      "icon": "",
      "text_color": "",
      "value_color": "green",
      "icon_color": "blue"
    },
    {
      "text": "CPU",
      "keyword": "cpu",
      "icon": "",
      "text_color": "",
      "value_color": "blue",
      "icon_color": "cyan"
    },
    {
      "text": "RAM",
      "keyword": "ram",
      "icon": "",
      "text_color": "",
      "value_color": "white",
      "icon_color": "red"
    },
    {
      "text": "Drive",
      "keyword": "drive",
      "icon": "",
      "text_color": "",
      "value_color": "yellow",
      "icon_color": "blue"
    },
    {
      "text": "GPU Usage",
      "keyword": "gpu %",
      "icon": "",
      "text_color": "",
      "value_color": "purple",
      "icon_color": "green"
    },
    {
      "text": "CPU Usage",
      "keyword": "cpu %",
      "icon": "",
      "text_color": "",
      "value_color": "red",
      "icon_color": "yellow"
    },
    {
      "text": "RAM Usage",
      "keyword": "ram %",
      "icon": "",
      "text_color": "",
      "value_color": "cyan",
      "icon_color": "purple"
    },
    {
      "text": "Drive Usage",
      "keyword": "drive %",
      "icon": "",
      "text_color": "",
      "value_color": "green",
      "icon_color": "blue"
    },
    {
      "text": "Terminal",
      "keyword": "term",
      "icon": "",
      "text_color": "",
      "value_color": "blue",
      "icon_color": "cyan"
    },
    {
      "text": "Processes",
      "keyword": "processes",
      "icon": "",
      "text_color": "",
      "value_color": "white",
      "icon_color": "red"
    },
    {
      "text": "Window Manager",
      "keyword": "wm",
      "icon": "",
      "text_color": "",
      "value_color": "yellow",
      "icon_color": "blue"
    },
    {
      "text": "IP Address",
      "icon": "",
      "text_color": "",
      "value_color": "purple",
      "icon_color": "green",
      "value": "hidden"
    },
    {
      "text": "Public IP Address",
      "icon": "",
      "text_color": "",
      "value_color": "red",
      "icon_color": "yellow",
      "value": "hidden"
    },
    {
      "text": "Resolution",
      "keyword": "resolution",
      "icon": "",
      "text_color": "",
      "value_color": "cyan",
      "icon_color": "purple"
    }
  ],
  "ascii": {
    "path": "gysmo2",
    "colors": "",
    "enabled": true,
    "horizontal_padding": 20,
    "vertical_padding": 0,
    "position": "top"
  },
  "header": {
    "text": "",
    "text_color": "",
    "line_color": "red",
    "line": true,
    "enabled": false
  },
  "footer": {
    "text": "Footer",
    "text_color": "",
    "line_color": "red",
    "line": true,
    "enabled": false
  },
  "general": {
    "menu_type": "list",
    "columns": true
  }
}
